{
  "estado": "12345678-1234-4234-8234-123456789012.AAAAAAAAAAAAAAAAAAAAAAAAAAAAAAAAAAAAAAAAAAA.BBBBBBBBBBBBBBBBBBBBBBBBBBBBBBBBBBBBBBBBBBB",
  "codigoAutorizacion": "CODIGO-AUTORIZACION-FICTICIO-NO-REAL",
  "verificadorCodigo": "VERIFICADOR-PKCE-FICTICIO-AAAAAAAAAAAAAAAAAAAAAAAAAAAAAAAAAAAA",
  "uriRedireccion": "http://127.0.0.1:48127/",
  "idsSeleccionados": ["ARCHIVO-FICTICIO-SELECCIONADO-ETAPA-27"],
  "alcanceConcedido": "https://www.googleapis.com/auth/drive.file"
}
